{
  "$schema": "http://json-schema.org/draft-07/schema#",
  "$id": "https://raw.githubusercontent.com/nearmap/shipyard/main/config/schema.json",
  "title": "Shipyard configuration",
  "description": "Non-secret Shipyard configuration. Resolved by sy_tools/config.py across three layers, lowest precedence first: ~/.shipyard/config.json, <repo>/.shipyard/config.json (committed), <repo>/.shipyard/config.local.json (gitignored). Secrets never belong here — the resolver refuses any credential-shaped key.",
  "type": "object",
  "additionalProperties": false,
  "properties": {
    "$schema": { "type": "string" },
    "tracker": {
      "type": "string",
      "description": "Which tracker adapter to use. Must name a directory under skills/tracker/.",
      "minLength": 1
    },
    "worktree": {
      "type": "object",
      "additionalProperties": false,
      "properties": {
        "root": {
          "type": ["string", "null"],
          "description": "Directory holding /sy:ship worktrees. Null means a sibling <repo>-worktrees/ beside the repo."
        }
      }
    },
    "memory": {
      "type": "object",
      "additionalProperties": false,
      "properties": {
        "dir": {
          "type": ["string", "null"],
          "description": "Memory store root. Null means ~/.claude/shipyard/memory."
        }
      }
    },
    "scratch": {
      "type": "object",
      "additionalProperties": false,
      "properties": {
        "dir": {
          "type": ["string", "null"],
          "description": "Root for per-identifier ephemeral working directories. Null means ~/.claude/shipyard/scratch."
        }
      }
    },
    "debug": {
      "type": "object",
      "additionalProperties": false,
      "properties": {
        "evals": {
          "type": "boolean",
          "description": "Write the trigger/trace event log."
        }
      }
    },
    "ci": {
      "type": "object",
      "additionalProperties": false,
      "properties": {
        "poll_timeout": {
          "type": "integer",
          "minimum": 0,
          "description": "Seconds before the CI poller gives up."
        },
        "poll_interval": {
          "type": "integer",
          "minimum": 1,
          "description": "Seconds between CI poll attempts."
        }
      }
    },
    "columns": {
      "type": "object",
      "description": "Board column names for the five canonical statuses. All five are required; matching is case-insensitive.",
      "additionalProperties": false,
      "properties": {
        "backlog": { "type": ["string", "null"] },
        "ready": { "type": ["string", "null"] },
        "in_progress": { "type": ["string", "null"] },
        "in_review": { "type": ["string", "null"] },
        "done": { "type": ["string", "null"] }
      }
    },
    "tracker_config": {
      "type": "object",
      "description": "Adapter-specific configuration. The resolver passes this through uninterpreted; the selected adapter declares its own required keys in its ADAPTER.md and config-map.json.",
      "additionalProperties": true
    },
    "models": {
      "type": "object",
      "additionalProperties": false,
      "properties": {
        "tiers": {
          "type": "object",
          "description": "Named tiers mapped to concrete model aliases, so raising the frontier tier is one edit rather than one per agent.",
          "additionalProperties": { "type": "string" }
        },
        "agents": {
          "type": "object",
          "description": "Per-agent bindings. `model` is either a tier name or a concrete model alias, resolved at dispatch. `effort` is resolved and clamped the same way and passed as the Agent invocation's `effort` parameter (see docs/configuration.md).",
          "additionalProperties": {
            "type": "object",
            "additionalProperties": false,
            "properties": {
              "model": { "type": "string", "minLength": 1 },
              "effort": {
                "type": "string",
                "enum": ["low", "medium", "high", "xhigh", "max"]
              }
            }
          }
        }
      }
    },
    "limits": {
      "type": "object",
      "additionalProperties": false,
      "properties": {
        "max_depth_agents": {
          "type": "integer",
          "minimum": 1,
          "description": "Cross-cutting cap on simultaneous depth-investigation subagents (sy:trace/sy:hunt/etc.) in flight per phase — ship, spec, spike, and sy:gate all read this same key."
        }
      }
    },
    "plan": {
      "type": "object",
      "additionalProperties": false,
      "properties": {
        "max_active_tasks": {
          "type": "integer",
          "minimum": 1,
          "description": "Cap on /sy:spec-ready Tasks a roadmap keeps active under one Epic at once."
        }
      }
    },
    "spec": {
      "type": "object",
      "additionalProperties": false,
      "properties": {
        "max_spec_gate_rounds": {
          "type": "integer",
          "minimum": 1,
          "description": "How many times /sy:spec may dispatch sy:spec-gate for the same session before the guard denies a further dispatch and the session must stop and ask you how to proceed. Per session, not per plan — a session that runs /sy:spec on two tickets in a row shares one budget. A dispatch consumes a round even if later aborted."
        }
      }
    },
    "ship": {
      "type": "object",
      "additionalProperties": false,
      "properties": {
        "request_ci_reviewer": {
          "type": "boolean",
          "description": "Whether GATE requests an automated code-review bot (e.g. Copilot) on the PR, in addition to sy:gate's own independent review."
        },
        "merge_strategy": {
          "type": "string",
          "enum": ["squash", "merge", "rebase"],
          "description": "Strategy passed to `gh pr merge`. Only squash composes a subject/body from the PR description; merge and rebase have none to compose."
        },
        "merge_admin": {
          "type": "boolean",
          "description": "Whether an authorized merge passes `--admin` to `gh pr merge`, for a repository whose ruleset the author cannot satisfy alone. It bypasses the ruleset, never CI or review freshness, and never authorizes a merge by itself."
        },
        "escalation": {
          "type": "object",
          "additionalProperties": false,
          "properties": {
            "max_needs_decision": {
              "type": "integer",
              "minimum": 1,
              "description": "A ship phase exceeding this many needs-decision returns without reaching done escalates to /sy:spec as underspecified."
            },
            "max_needs_trace": {
              "type": "integer",
              "minimum": 1,
              "description": "A ship phase exceeding this many needs-trace returns without reaching done escalates to /sy:spec as missing evidence, on its own separate count."
            },
            "max_gate_rounds": {
              "type": "integer",
              "minimum": 1,
              "description": "A GATE phase whose fix-cycle rounds for the run have reached this many without converging returns needs-decision (tagged max_gate_rounds) rather than continuing; a count that has reached the cap is a breach, so the cap-th round is the last one allowed. The count is never reset merely because a fix round pushes a new head, only by an explicit raise-budget disposition."
            }
          }
        }
      }
    },
    "skills": {
      "type": "object",
      "additionalProperties": false,
      "properties": {
        "standards": {
          "type": ["string", "null"],
          "minLength": 1,
          "maxLength": 100,
          "pattern": "^[a-z0-9][a-z0-9-]*(:[a-z0-9][a-z0-9-]*)?$",
          "description": "This repository's own engineering-standards skill, as a bare name or the plugin:skill form. Null means there is none, and the standards pass resolves repo docs itself."
        },
        "reviewer": {
          "type": ["string", "null"],
          "minLength": 1,
          "maxLength": 100,
          "pattern": "^[a-z0-9][a-z0-9-]*(:[a-z0-9][a-z0-9-]*)?$",
          "description": "This repository's own code-review skill, as a bare name or the plugin:skill form, run by sy:gate as an additive pass. Null means there is none and no extra review runs."
        }
      }
    },
    "text": {
      "type": "object",
      "additionalProperties": false,
      "properties": {
        "reader": {
          "type": "string",
          "minLength": 1,
          "maxLength": 200,
          "description": "Who a durable human-facing artifact is written for, applied by /sy:tighten as an authoring instruction that is never executed and never a length target."
        }
      }
    },
    "redaction": {
      "type": "object",
      "additionalProperties": false,
      "properties": {
        "extra_words": {
          "type": "array",
          "description": "Org-specific credential-name fragments merged into the built-in secret-word list (sy_tools/secrets.py) used to scrub tracker writes and to refuse credential-shaped config keys. Each entry must be a single alphanumeric word (the matcher is word-based, not substring-based, so a multi-word entry like 'ID_RSA' would silently never match anything).",
          "items": { "type": "string", "minLength": 1, "pattern": "^[A-Za-z0-9]+$" }
        }
      }
    }
  }
}
