{
  "tracker": "jira",
  "worktree": {
    "root": null
  },
  "memory": {
    "dir": null
  },
  "scratch": {
    "dir": null
  },
  "debug": {
    "evals": false
  },
  "ci": {
    "poll_timeout": 1800,
    "poll_interval": 30
  },
  "columns": {
    "backlog": null,
    "ready": null,
    "in_progress": null,
    "in_review": null,
    "done": null
  },
  "tracker_config": {},
  "limits": {
    "max_depth_agents": 3
  },
  "plan": {
    "max_active_tasks": 4
  },
  "spec": {
    "max_spec_gate_rounds": 5
  },
  "ship": {
    "request_ci_reviewer": true,
    "merge_strategy": "squash",
    "merge_admin": false,
    "escalation": {
      "max_needs_decision": 3,
      "max_needs_trace": 2,
      "max_gate_rounds": 5
    }
  },
  "skills": {
    "standards": null,
    "reviewer": null
  },
  "text": {
    "reader": "Use ste100 Simplified Technical English eli15 tldr dot points"
  },
  "redaction": {
    "extra_words": []
  },
  "models": {
    "tiers": {
      "frontier": "fable",
      "frontier_fallback": "opus",
      "standard": "opus",
      "cheap": "sonnet"
    },
    "agents": {
      "debate": { "model": "standard", "effort": "high" },
      "debater": { "model": "standard", "effort": "high" },
      "explain-author": { "model": "standard", "effort": "high" },
      "gate": { "model": "frontier", "effort": "max" },
      "gate-triage": { "model": "standard", "effort": "high" },
      "hunt": { "model": "standard", "effort": "medium" },
      "img-inspector": { "model": "cheap", "effort": "medium" },
      "repo-review": { "model": "frontier", "effort": "max" },
      "repo-standards": { "model": "standard", "effort": "high" },
      "seam": { "model": "standard", "effort": "high" },
      "ship-build": { "model": "standard", "effort": "high" },
      "ship-gate": { "model": "cheap", "effort": "low" },
      "ship-start": { "model": "cheap", "effort": "high" },
      "slice": { "model": "standard", "effort": "high" },
      "spec-gate": { "model": "standard", "effort": "high" },
      "sweep": { "model": "cheap", "effort": "high" },
      "trace": { "model": "standard", "effort": "high" }
    }
  }
}
